{
  "$schema": "./schema.json",
  "kurumUst": "T.C.",
  "kurumAdi": "ASİ KÖRFEZ BELEDİYESİ",
  "mudurluk": "Destek Hizmetleri Müdürlüğü",
  "kurumumuz": "Belediyemiz",
  "alimTuru": "mal alımı",
  "evrakSayisi": "74839201",
  "tarih": "12/04/2026",
  "dosyaTarihi": "12/04/2026",
  "isAdi": "Atatürk Parkı Çevre Düzenlemesi ve Peyzaj Yapım İşi",
  "hazirlayanPersonelAdi": "Gökhan TEKİN",
  "hazirlayanPersonelUnvan": "Teknisyen",
  "fiyatKomisyonu": [
    {
      "gorevi": "Komisyon Başkanı",
      "adSoyad": "Canan YILDIZ",
      "unvan": "Mühendis"
    },
    {
      "gorevi": "Komisyon Üyesi",
      "adSoyad": "Murat ARSLAN",
      "unvan": "Tekniker"
    },
    {
      "gorevi": "Komisyon Üyesi",
      "adSoyad": "Ebru ŞEN",
      "unvan": "Memur"
    },
    {
      "gorevi": "Komisyon Üyesi",
      "adSoyad": "Gökhan TEKİN",
      "unvan": "Teknisyen"
    }
  ],
  "muayeneKomisyonu": [
    {
      "gorevi": "Komisyon Başkanı",
      "adSoyad": "Canan YILDIZ",
      "unvan": "Mühendis"
    },
    {
      "gorevi": "Komisyon Üyesi",
      "adSoyad": "Serkan AYDIN",
      "unvan": "Memur"
    },
    {
      "gorevi": "Komisyon Üyesi",
      "adSoyad": "Zeynep KILIÇ",
      "unvan": "Tekniker"
    }
  ],
  "baskanAdi": "Kemal SOYDAN",
  "baskanUnvan": "Belediye Başkanı",
  "solLogo": "https://raw.githubusercontent.com/ilyasbozdemir/workdesk-360/main/public/icon.png",
  "sagLogo": "https://upload.wikimedia.org/wikipedia/commons/0/0f/Logo_of_100th_years_of_the_Republic_of_T%C3%BCrkiye.svg",
  "kurumIci": false
}
